Group,Sub_group,Population_2025,Percentage_in_country,Percentage_in_Africa,Language,Region,Sources,Ancient_Name,Description,Type_de_societe,Religion,Famille_linguistique,Statut_historique,Presence_regionale
Arabes,"Arabes marocains (Hilaliens, Mourabitoun, Andalous)",24700000,65.0,1.727273,Darija (arabe maghrébin),"Plaines atlantiques, grandes villes","HCP Maroc, Ethnologue","Dynasties arabes, émigrations andalouses",Groupe majoritaire issu de vagues hilaliennes et andalouses,Urbaine & rurale,Islam sunnite (malékite),Sémitique,"Dynasties arabes (Idrissides, Almoravides)",Maghreb
Amazigh (Imazighen) – Souss,Chleuh (Tashelhit),5700000,15.0,0.398601,Tashelhit,"Souss, Haut-Atlas occidental","HCP, IRCAM",Royaumes amazighs du Sud,Peuple berbère du Souss,Montagnarde agricole,Islam sunnite,Afro-asiatique (berbère),Royaumes du Souss,Maroc Sud
Amazigh – Rifains,Rifains (Tarifit),1900000,5.0,0.132867,Tarifit,Rif (nord),IRCAM,"Émirat du Rif, Abdelkrim El Khattabi",Peuple amazigh du nord,\Montagnard,Islam sunnite,Berbère,Émirat du Rif,Nord Maroc
Amazigh – Atlas,"Zayanes, Beni Mguild, Aït Atta",3040000,8.0,0.212587,Tamazight (Moyen Atlas),Moyen & Haut-Atlas,IRCAM,Confédérations amazighes,Sociétés tribales amazighes des montagnes,Pastoraliste/agricole,Islam sunnite,Berbère,Tribus du Moyen-Atlas,Maroc central
Sahraouis,Sahraouis hassaniya,1520000,4.0,0.106294,Hassaniya,"Sahara, Laâyoune, Dakhla","ONU, Ethnologue",Tribus bidanes du Sahara,Peuples du désert saharien,Nomade/pastorale,Islam sunnite,Arabe-hassani,Émirats sahariens,Mauritanie
Gnawa,Gnawa (descendants d’esclaves sahéliens),380000,1.0,0.026573,Arabe + dialectes gnawa,"Urbain (Marrakech, Essaouira)",Études anthropologiques,Sultanats marocains,Communauté soufie d’origine africaine subsaharienne,Urbain soufi,Islam soufi,Divers (mandé/haoussa),Confréries gnawa,Maroc
Haratin,Haratin (oasis sahariennes),380000,1.0,0.026573,Arabe hassani + berbère,"Oasis sud, vallée du Drâa",Anthropologie Maghreb,Sultanats du Sud,Communautés oasisiennes afro-amazighes,Oasienne agricole,Islam sunnite,Afro-berbère,Oasis sahariennes,Sahara
Jbala,Jbala du Nord-Ouest,1140000,3.0,0.07972,Dialecte jbala,"Rif occidental, Chefchaouen",Ethnologue Maroc,Tribus Jbala,Population montagnarde arabophone,Montagnarde,Islam sunnite,Arabo-berbère,Tribus Jbala,Nord-Ouest
Autres,"Juifs marocains, Sahéliens, migrants",380000,1.0,0.026573,Divers,Urbain,HCP Maroc,Diaspora ancienne,Groupes minoritaires,Urbain,Judaïsme/Islam,Divers,Diasporas,Maroc
